{
  "$schema": "https://json-schema.org/draft/2020-12/schema",
  "$id": "https://contracts.tilo.example/agents.schema.json",
  "x-version": "1.0.0",
  "title": "AgentsConfig",
  "description": "config/agents.yaml: the harness's role limits (PRD 8.1, FR-AGT-01), context thresholds and liveness timings (8.5, FR-AGT-09, FR-AGT-10), retries (FR-AGT-13) and question load control (8.3). Values the PRD fixes are const; the rest are bounded so config cannot loosen a stated limit.",
  "type": "object",
  "additionalProperties": false,
  "required": ["limits", "context", "liveness", "retries", "questions"],
  "properties": {
    "limits": { "$ref": "#/$defs/limits" },
    "context": { "$ref": "#/$defs/context" },
    "liveness": { "$ref": "#/$defs/liveness" },
    "retries": { "$ref": "#/$defs/retries" },
    "questions": { "$ref": "#/$defs/questions" }
  },
  "$defs": {
    "limits": {
      "description": "Role limits (PRD 8.1).",
      "type": "object",
      "additionalProperties": false,
      "required": ["directors_per_world", "leads_per_district", "max_specialists", "max_depth"],
      "properties": {
        "directors_per_world": { "const": 1 },
        "leads_per_district": { "const": 1 },
        "max_specialists": {
          "description": "Specialists running at once in one world, at most 6 (PRD 8.1).",
          "type": "integer",
          "minimum": 1,
          "maximum": 6
        },
        "max_depth": {
          "description": "Agent levels below the owner (PRD 8.1: capped at three).",
          "const": 3
        }
      }
    },
    "context": {
      "description": "Share of an agent's context window (PRD 8.5). handoff_at is fixed at 0.70 (D-08, FR-AGT-09), so 0 < compact_at < handoff_at < 1 reduces to compact_at below 0.70 (BQ-58).",
      "type": "object",
      "additionalProperties": false,
      "required": ["compact_at", "handoff_at"],
      "properties": {
        "compact_at": { "type": "number", "exclusiveMinimum": 0, "exclusiveMaximum": 0.7 },
        "handoff_at": {
          "description": "Fixed at 0.70; minimum and maximum repeat the const so generated Python checks it too.",
          "type": "number",
          "const": 0.7,
          "minimum": 0.7,
          "maximum": 0.7
        }
      }
    },
    "liveness": {
      "description": "Crash recovery (PRD 8.5, FR-AGT-10): each agent sends a heartbeat every heartbeat_s seconds; the sweeper restarts an agent silent for silent_after_s seconds from its last checkpoint. The harness loader also requires silent_after_s > heartbeat_s.",
      "type": "object",
      "additionalProperties": false,
      "required": ["heartbeat_s", "silent_after_s"],
      "properties": {
        "heartbeat_s": { "type": "integer", "minimum": 1 },
        "silent_after_s": { "type": "integer", "minimum": 1 }
      }
    },
    "retries": {
      "description": "Attempts per unit, the first included; after max_attempts failures the unit escalates (FR-AGT-13), which is the PRD 8.3 must-ask 'a unit fails 3 times', so at most 3.",
      "type": "object",
      "additionalProperties": false,
      "required": ["max_attempts"],
      "properties": {
        "max_attempts": { "type": "integer", "minimum": 1, "maximum": 3 }
      }
    },
    "questions": {
      "description": "Load control (PRD 8.3): questions to one person per hour before the rest go into a digest.",
      "type": "object",
      "additionalProperties": false,
      "required": ["hourly_cap_per_person"],
      "properties": {
        "hourly_cap_per_person": { "type": "integer", "minimum": 1 }
      }
    }
  }
}
